	Biamonti	Hess	Op.	Grove	WoO	Title 1	Title 2	Composition Dates 1	Composition Dates 2	Notes 1	Key	Scoring	Genre	Notes 2	Same As	ROW 2
1012	656	—	101	101	—	Piano Sonata No. 28 in A major	Piano Sonata No.28	1816	1816	dedicated to Baroness Dorothea von Ertmann	A major	pf	Keyboard		"Op. 101, Grove 101"	184
1013						"Sketch for Unknown: ""Christ ist erstanden""; perhaps for an oratorio; authorship: unfinished"			1815							
1014	658	—	—	249	147	"Song in A major: ""Ruf vom Berge""; ""Wenn ich ein Vöglein wär"""	"Ruf vom Berge (""Wenn ich ein Vöglein wär"")"	1816	1816	words: Georg Friedrich Treitschke	A major	v pf	Vocal		"WoO 147, Grove 249"	475
1015	659	—	093	093	—	Symphony No. 8 in F major	Symphony No.8	1812	1812	dedicated to (none)	F major	orch	Orchestral		"Op. 93, Grove 93"	170
1016	660/	—	108/		—		Scottish Songs (25):	1815-18				v vn vc pf	Vocal			209
1017	660/1	—	108/01	108/01	—	"Folksong Setting: ""Music, Love and Wine""; ""O let me music hear, night and day!""; #1 of 25 Scottish songs"	"Music, Love and Wine (""O let me music hear, night and day!"")"	1817	1817	words: William Smyth		v vn vc pf	Vocal		"Op. 108 #1, Grove 108"	210
1018	660/2	—	108/02	108/02	—	"Folksong Setting: ""Sunset""; ""The sun upon the Weirdlaw Hill""; #2 of 25 Scottish songs"	"Sunset (""The sun upon the Weirdlaw Hill"")"	1818	1818	words: Sir Walter Scott		v vn vc pf	Vocal		"Op. 108 #2, Grove 108"	211
1019	660/3	—	108/03	108/03	—	"Folksong Setting: ""O sweet were the hours""; #3 of 25 Scottish songs"	O Sweet were the Hours	1817	1817	words: William Smyth		v vn vc pf	Vocal		"Op. 108 #3, Grove 108"	212
1020	660/4	—	108/04	108/04	—	"Folksong Setting: ""The Maid of Isla""; ""O maid of Isla from yon cliff"" ; #4 of 25 Scottish songs"	"The Maid of Isla (""O maid of Isla from yon cliff"")"	1817	1817	words: Sir Walter Scott		v vn vc pf	Vocal		"Op. 108 #4, Grove 108"	213
1021	660/5	—	108/05	108/05	—	"Folksong Setting: ""The sweetest lad was Jamie""; #5 of 25 Scottish songs"	The Sweetest Lad was Jamie	1815	1815	words: William Smyth		v vn vc pf	Vocal		"Op. 108 #5, Grove 108"	214
1022	660/6	—	108/06	108/06	—	"Folksong Setting: ""Dim, dim is my eye""; #6 of 25 Scottish songs"	"Dim, Dim is my Eye"	1815	1815	words: William Brown		v vn vc pf	Vocal		"Op. 108 #6, Grove 108"	215
1023	660/7	—	108/07	108/07	—	"Folksong Setting: ""Bonnie Laddie, Highland Laddie""; ""Where got ye that siller moon""; #7 of 25 Scottish songs"	"Bonnie Laddie, Highland Laddie (""Where got ye that siller moon"")"	1815	1815	words: James Hogg		v vn vc pf	Vocal		"Op. 108 #7, Grove 108"	216
1024	660/8	—	108/08	108/08	—	"Folksong Setting: ""The lovely lass of Inverness""; #8 of 25 Scottish songs"	The Lovely Lass of Inverness	1816	1816	words: Robert Burns		v vn vc pf	Vocal		"Op. 108 #8, Grove 108"	217
1025	660/9	—	108/09	108/09	—	"Folksong Setting: ""Behold, my Love""; ""Behold my Love how green the groves""; #9 of 25 Scottish songs"	Behold my Love how Green the Groves	1817	1817	words: Robert Burns		v vn vc pf	Vocal		"Op. 108 #9, Grove 108"	218
1026	660/10	—	108/10	108/10	—	"Folksong Setting: ""Sympathy""; ""Why, Julia, say, that pensive mien?""; #10 of 25 Scottish songs"	"Sympathy (""Why, Julia, say, that pensive mien?"")"	1815	1815	words: William Smyth		v vn vc pf	Vocal		"Op. 108 #10, Grove 108"	219
1027	660/11	—	108/11	108/11	—	"Folksong Setting: ""O! thou art the lad of my heart, Willy""; #11 of 25 Scottish songs"	O! Thou Art the Lad of my Heart	1815	1815	words: William Smyth; variations on this air: Op 107 #9		v vn vc pf	Vocal		"Op. 108 #11, Grove 108"	220
1028	660/12	—	108/12	108/12	—	"Folksong Setting: ""O, had my fate been join’d with thine""; #12 of 25 Scottish songs"	"O, Had My Fate Been Join'd With Thine"	1816	1816	words: Lord Byron		v vn vc pf	Vocal		"Op. 108 #12, Grove 108"	221
1029	660/13	—	108/13	108/13	—	"Folksong Setting: ""Come fill, fill, my good fellow!""; #13 of 25 Scottish songs"	"Come Fill, Fill, my Good fellow!"	1817	1817	words: William Smyth		v vn vc pf	Vocal		"Op. 108 #13, Grove 108"	222
1030	660/14	—	108/14	108/14	—	"Folksong Setting: ""O, how can I be blithe and glad""; #14 of 25 Scottish songs"	"O, How Can I Be Blithe and Glad"	1816	1816	words: Robert Burns		v vn vc pf	Vocal		"Op. 108 #14, Grove 108"	223
1031	660/15	—	108/15	108/15	—	"Folksong Setting: ""O cruel was my father""; #15 of 25 Scottish songs"	O Cruel Was My Father	1816	1816	words: Alexander Ballantyne		v vn vc pf	Vocal		"Op. 108 #15, Grove 108"	224
1032	660/16	—	108/16	108/16	—	"Folksong Setting: ""Could this ill world have been contriv’d""; #16 of 25 Scottish songs"	Could This Ill World Have Been Contriv'd	1816	1816	words: James Hogg		v vn vc pf	Vocal		"Op. 108 #16, Grove 108"	225
1033	660/17	—	108/17	108/17	—	"Folksong Setting: ""O Mary, at thy window be""; #17 of 25 Scottish songs"	"O Mary, at Thy Window Be"	1817	1817	words: Robert Burns		v vn vc pf	Vocal		"Op. 108 #17, Grove 108"	226
1034	660/18	—	108/18	108/18	—	"Folksong Setting: ""Enchantress, farewell""; #18 of 25 Scottish songs"	"Enchantress, Farewell"	1818	1818	words: Sir Walter Scott		v vn vc pf	Vocal		"Op. 108 #18, Grove 108"	227
1035	660/19	—	108/19	108/19	—	"Folksong Setting: ""O swiftly glides the bonny boat""; #19 of 25 Scottish songs"	O Swiftly Glides the Bonny Boat	1815	1815	words: Joanna Baillie		v vn vc pf	Vocal		"Op. 108 #19, Grove 108"	228
1036	660/20	—	108/20	108/20	—	"Folksong Setting: ""Faithfu’ Johnie"" ""When will you come again""; #20 of 25 Scottish songs"	Faithfu' Johnie (When will you come again)	1813	1813	words: Anne Grant; replacement setting for Hess 203		v vn vc pf	Vocal		"Op. 108 #20, Grove 108"	229
1037	660/21	—	108/21	108/21	—	"Folksong Setting: ""Jeanie’s Distress""; ""By William late offended""; #21 of 25 Scottish songs"	"Jeanie's Distress (""By William late offended"")"	1817	1817	words: William Smyth		v vn vc pf	Vocal		"Op. 108 #21, Grove 108"	230
1038	660/22	—	108/22	108/22	—	"Folksong Setting: ""The Highland Watch""; ""Old Scotia, wake thy mountain strain""; #22 of 25 Scottish songs"	"The Highland Watch (""Old Scotia, wake thy mountain strain"")"	1817	1817	words: James Hogg		v vn vc pf	Vocal		"Op. 108 #22, Grove 108"	231
1039	660/23	—	108/23	108/23	—	"Folksong Setting: ""The Shepherd’s Song""; ""The gowan glitters on the sward""; #23 of 25 Scottish songs"	"The Shepherd's Song (""The gowan glitters on the sward"")"	1818	1818	words: Joanna Baillie		v vn vc pf	Vocal		"Op. 108 #23, Grove 108"	232
1040	660/24	—	108/24	108/24	—	"Folksong Setting: ""Again, my Lyre, yet once again""; #24 of 25 Scottish songs"	"Again, my Lyre"	1815	1815	words: William Smyth		v vn vc pf	Vocal		"Op. 108 #24, Grove 108"	233
1041	660/25	—	108/25	108/25	—	"Folksong Setting: ""Sally in our Alley""; ""Of all the girls that are so smart""; #25 of 25 Scottish songs"	"Sally in Our Alley (""Of all the girls that are so smart"")"	1817	1817	words: Henry Carey		v vn vc pf	Vocal		"Op. 108 #25, Grove 108"	234
1042	661/@@@	200				"Folksong Setting: ""The Maid of Isla"" (Scottish)"			1816	earlier version of Opus 108 #4					Hess 200	
1043	661/@@@	201				"Folksong Setting: ""Bonnie Laddie, Highland Laddie"" (Scottish)"			1816 - 1818	other version of violin part of Opus 108 #7					Hess 201	
1044	661/@@@	202				"Folksong Setting: ""O! thou art the lad of my heart, Willy"" (Scottish)"			1815	first version of Opus 108 #11					Hess 202	
1045	661/@@@	203				"Folksong Setting: ""Faithfu’ Johnie"" (Scottish) ""When will you come again"""			1810	words: Anne Grant; original setting of Opus 108 #20					Hess 203	
1046	662	096				Fragment for Piano; authorship: unfinished			1813	"fragment of Symphony #7, Opus 92, for piano - first 46 measures of first movement"					Hess 96	
1047	663/	—	—		158a		Songs of Various Nationalities (23)	1816-17				vv vn vc pf	Vocal		WoO 158 (all)	486
1048	663/1														@@@	
1049	663/2	172			158/02@@@	"Folksong Setting: ""Horch auf, mein Liebchen"" (German) WoO 158a; #2 of 23 continental folk songs"			1816						"WoO 158 #2, Hess 172"	
1050	663/3	173			158/03@@@	"Folksong Setting: ""Wegen meiner blieb d’Fräula"" (German) WoO 158a; #3 of 23 continental folk songs"			1816						"WoO 158 #3, Hess 173"	
1051	663/4	174			158/04@@@	"Folksong Setting: ""Wann i in der Früh aufsteh"" (Tyrolean) WoO 158a; #4 of 23 continental folk songs"			1816						"WoO 158 #4, Hess 174"	
1052	663/5	182			158/05@@@	"Folksong Setting: ""Teppichkrämer-Lied""; ""I bin a Tyroler Bua"" (Tyrolean) WoO 158a; #5 of 23 continental folk songs"			1816	variations on this air: Op 107 #1					"WoO 158 #5, Hess 182"	
1053	663/6	183			158/06@@@	"Folksong Setting: ""A Madel, ja a Madel"" (Tyrolean) WoO 158a; #6 of 23 continental folk songs"			1816	variations on this air: Op 107 #5					"WoO 158 #6, Hess 183"	
1054	663/7														@@@	
1055	663/8														@@@	
1056	663/9	184			158/09@@@	"Folksong Setting: ""Oj, oj upilem sie w karczmie"" (Polish) WoO 158a; #9 of 23 continental folk songs"			1816						"WoO 158 #9, Hess 184"	
1057	663/10	185			158/10@@@	"Folksong Setting: ""Poszla baba po popiol"" (Polish) WoO 158a; #10 of 23 continental folk songs"			1816						"WoO 158 #10, Hess 185"	
1058	663/11	158			158/11@@@	"Folksong Setting: ""Yo no quiero embarcarme"" (Iberian) WoO 158a; #11 of 23 continental folk songs"			1816						"WoO 158 #11, Hess 158"	
1059	663/12	159			158/12@@@	"Folksong Setting: ""Seus lindos olhos"" (Portuguese) WoO 158a; #12 of 23 continental folk songs"			1816						"WoO 158 #12, Hess 159"	
1060	663/13	160			158/13@@@	"Folksong Setting: ""Vo lesocke komarockov mnogo urodilos"" (Im Walde sind viele Mücklein geboren) (Russian) WoO 158a; #13 of 23 continental folk songs"			1816						"WoO 158 #13, Hess 160"	
1061	663/14	161			158/14@@@	"Folksong Setting: ""Akh, recen’ki, recen’ki"" (Ach Bächlein, Bächlein, kühle Wasser) (Russian) WoO 158a; #14 of 23 continental folk songs"			1816						"WoO 158 #14, Hess 161"	
1062	663/15	162			158/15@@@	"Folksong Setting: ""Kak Posli nasi podruzki"" (As They Went) (Unsere Mädchen gingen in den Wald) (Russian) WoO 158a; #15 of 23 continental folk songs"			1816						"WoO 158 #15, Hess 162"	
1063	663/16														@@@	
1064	663/17														@@@	
1065	663/18	171			158/18@@@	"Folksong Setting: ""An ä Bergli bin i gesässe"" (Swiss) WoO 158a; #18 of 23 continental folk songs"			1816						"WoO 158 #18, Hess 171"	
1066	663/19	163			158/19@@@	"Folksong Setting: ""Una paloma blanca"" (Spanish Bolero a Solo) WoO 158a; #19 of 23 continental folk songs"			1816	original and different coda					"WoO 158 #19, Hess 163"	
1067	663/20	164			158/20@@@	"Folksong Setting: ""Como la mariposa soy"" (Spanish Bolero a due) WoO 158a; #20 of 23 continental folk songs"			1816	Hess 207 is the first version of the coda					"WoO 158 #20, Hess 164"	
1068	663/21	165			158/21@@@	"Folksong Setting: ""Tiranilla Española"" (Spanish); ""La tiranna se embarca"" WoO 158a; #21 of 23 continental folk songs"			1816						"WoO 158 #21, Hess 165"	
1069	663/22														@@@	
1070		181			158/23@@@	"Folksong Setting: ""Da brava, Catina"" (Venetian) WoO 158a; #23 of 23 continental folk songs"			1816						"WoO 158 #23, Hess 181"	
1071	664					Sketch for Unknown in E flat major: for a march; authorship: unfinished			1815							
1072	665	011				Romance No. 3 for Violin & Orchestra			1816	lost					Hess 11	
1073	666					Fragment for Unknown: in a letter to Steiner			1816							
1074	667/	—	—		158b		British Folk Songs (7)	1810-17				vv vn vc pf	Vocal		WoO 158 (all) @@@	487
1075	667/1	152			158/01@@@	"Folksong Setting in A major: ""Adieu, my lov’d harp"" (Irish) WoO 158b; #1 of 7 British folk songs"			1813	words: Moore					"WoO 158 #1, Hess 152"	
1076	667/2	153			158/02@@@	"Folksong Setting in E flat major: ""Castle O’Neill"" (Irish), without words, WoO 158b; #2 of 7 British folk songs"			1813						"WoO 158 #2, Hess 153"	
1077	667/3	154			158/03@@@	"Folksong Setting in F major: ""Oh ono chri!"" (Scottish) ""O was not I a weary wight"" WoO 158b; #3 of 7 British folk songs"			1817						"WoO 158 #3, Hess 154"	
1078	667/4	155			158/04@@@	"Folksong Setting: ""Red gleams the sun on yon hill tap"" (Scottish) WoO 158b; #4 of 7 British folk songs"			1817						"WoO 158 #4, Hess 155"	
1079	667/5	157			158/05@@@	"Folksong Setting in G major: ""Erin! O Erin!"" (Scottish-Irish) ""Like the bride lamp that lay"" WoO 158b; #5 of 7 British folk songs"			1815						"WoO 158 #5, Hess 157"	
1080	667/6	170			158/06@@@	"Folksong Setting in A minor: ""O Mary ye’s be clad in silk"" (Scottish) WoO 158b; #6 of 7 British folk songs"			1815						"WoO 158 #6, Hess 170"	
1081	667/7	180			158/07@@@	"Folksong Setting in G minor: ""Lament for Owen Roe O’Neill"" (Irish) without words, WoO 158b; #7 of 7 British folk songs"			1810						"WoO 158 #7, Hess 180"	
1082	667/8	166			158/01@@@	"Folksong Setting in E minor: ""When my Hero in court appears"" WoO 158c; #1 of 6 assorted folk songs"			1817	words: John Gay					"WoO 158 #1, Hess 166"	
1083	667/9	167			158/02@@@	"Folksong Setting in B flat major: ""Air de Colin"" from Rousseau’s ""Le Devin du Village""; ""Non, non, Colette n’est point trompeuse"" WoO 158c; #2 of 6 assorted folk songs"			1817	words: Rousseau					"WoO 158 #2, Hess 167"	
1084	667/10	169			158/03@@@	"Folksong Setting in B major: ""Mark yonder pomp of costly fashion"" (Scottish) WoO 158c; #3 of 6 assorted folk songs"			1820	words: Robert Burns					"WoO 158 #3, Hess 169"	
1085	667/11	175			158/04@@@	"Folksong Setting in A major: ""Bonnie wee thing"" (Scottish) for 3 voices and piano WoO 158c; #4 of 6 assorted folk songs"			1820	words: Robert Burns					"WoO 158 #4, Hess 175"	
1086	667/12	176			158/05@@@	"Folksong Setting in B flat major: ""From thee, Eliza, I must go"" (Scottish) for 3 voices and piano trio WoO 158c; #5 of 6 assorted folk songs"			1818	words: Robert Burns					"WoO 158 #5, Hess 176"	
1087	667/13	179			158/06@@@	"Folksong Setting in E minor: Untitled (Scottish) without words, WoO 158c; #6 of 6 assorted folk songs"			1810						"WoO 158 #6, Hess 179"	
1088	668	047				Piano Trio				arrangement of String Trio Opus 3 (1st movement and fragment of 2nd movement)					Hess 47	
1089	669					"Sketch for Solo Voice(s) & Instrument(s): for the song ""Resignation"" for 4 voices; authorship: unfinished"			1817							
1090	670	—	—	251	148	"Song in F major: ""So oder so""; ""Nord oder Süd!"""	"So oder So (""Nord oder Süd!"")"	1817	1817	words: Carl Lappe	F major	v pf	Vocal		"WoO 148, Grove 251"	476
1091	671	288			205/03	"Musical greetings for Solo Voice(s): ""O Adjutant"" (WoO 205c), #3 of 10 musical greetings"			1817	written for Tobias Haslinger; Letter 742					"WoO 205 #3, Hess 288"	
1092	672					Fragment for Unknown			1817	in a letter to Steiner						
1093	673	—	—	197	104	"Song: ""Gesang der Mönche"" (Song of the Monks) from Schiller’s ""William Tell""; ""Rasch tritt der Tod den Menchen an"""	"Gesang der Mönche (""Rasch tritt der Tod den Menchen an"") (Song of the Monks)"	1817	1817	words: Friedrich von Schiller	C minor	2ten bass	Vocal	for the play ''William Tell'' by Friedrich Schiller	"WoO 104, Grove 197"	426
1094	674	289			205/04	"Musical greetings for Solo Voice(s) in C major: ""Wo? Wo?"" (WoO 205d), #4 of 10 musical greetings"			1817	written for Nanette Streicher; Letter 789 or 792					"WoO 205 #4, Hess 289"	
1095	675	—	104	104	—	String Quintet in C minor; authorship: arranged by another	String Quintet	1817	1817	after the Piano Trio Opus 1 #3; arranged by Kaufman; arrangement corrected by Beethoven	C minor	2vn 2va vc	Quintets	arrangement of Op.1/3	"Op. 104, Grove 104"	189
1096	676					Fragment for Unknown			1817	in a letter to Nanette Streicher						
1097	677					"Sketch for Solo Voice(s) & Instrument(s): for Matthisson’s ""Badlied""; authorship: unfinished"			1817	"lost, except for quotation by Nottebohm in his article on the Boldrini sketchbook, since vanished"						
1098	678	—	137	137	—	Fugue for String Quintet in D major	Fugue in D major	1817	1817		D major	2vn va vc	Chamber		"Op. 137, Grove 137"	266
1099	679	—	—	252	149	"Song in D major: ""Resignation""; ""Lisch aus, mein Licht!"""	"Resignation (""Lisch aus, mein Licht!"")"	1817	1817	words: Paul von Haugwitz	D major	v pf	Vocal		"WoO 149, Grove 252"	477
1100	680	036				"Fugue for String Quartet: from Handel’s ""Solomon"" overture, arranged for string quartet by Beethoven"			1798						Hess 36	
1101	681	138				"Song: ""Odorata - o Nice"""			1815 - 1817						Hess 138	
1102	682	137				"Song: ""Ich wiege dich in meinem Arm"""			1795	"lost; title incorrectly given by Hess as ""Schwinge dich in meinen Dom""; author unknown"					Hess 137	
1103	683	252	—		171	"4-part Canon in G major: ""Glück fehl’ dir vor allem!""; authorship: spurious"	"Glück fehl' dir vor allem!, canon"		1817	written for Anna Giannatasio del Rio; actually written by Michael Haydn	G major	4vv	Vocal	spurious; now believed to have been written by Michael Haydn	"WoO 171, Hess 252"	504
1104	684	040	—		—	String Quintet in D minor: movement; authorship: unfinished	String Quintet	1817	1817	"may have been the Prelude to a Fugue, since lost"	D minor	2vn 2va vc	Chamber	part of 1 movt. only	Hess 40	549
1105	685	035				Fragment for String Quartet in B minor; authorship: reconstruction			1817	"fragment of fugue #24 from Well-Tempered Clavier (Book One) by J S Bach, arranged for string quartet by Beethoven"					Hess 35	
1106	686					Sketch			1817 - 1818	"sketches for the Ninth Symphony Opus 125, second movement; also see Biamonti 746 & 779"						
1107	687					Sketch for Unknown: sketches found in the Conversation Book of Feb/ March 1818; authorship: unfinished			1818							
1108	688	075	—	198	200	"Piece for Piano in G major: ""O Hoffnung, du stählst die Herzen, du milderst die Schmerzen"""	O Hoffnung	1818	1818	"written for Archduke Rudolph of Austria; written as a theme for Archduke Rudolph, who composed forty variations on it; also see Hess 335"	G major	pf	Keyboard		"WoO 200, Hess 75, Grove 198"	536
1109	689	282	—		201	"Joke in C major: ""Ich bin bereit! Amen"" (I am ready), beginning of a double fugue"	Ich bin bereit	1818	1818	written for Vincent Hauschka; Letter 903	C major	pf	Keyboard		"WoO 201, Hess 282"	537
1110	690	—	—	172	060	"Bagatelle for Piano in B flat major: ""Zeimlich lebhaft"" (A little lively)"	Bagatelle in B-flat major ('Zeimlich lebhaft') ('A little lively')	1818	1818	dedicated to Marie Szymanowska	B♭ major	pf	Keyboard		"WoO 60, Grove 172"	355
1111	691/	—	—	227/	156/		Scottish Songs (12)	1815-19				vv vn vc pf	Vocal		"WoO 156 (all), Grove 227 (all)"	484
1112	691/1			227/01	156/01	"Folksong Setting: ""The Banner of Buccleuch"", ""From the brown crest of Newark""; #1 of 12 Scottish songs"			1819	words: Sir Walter Scott					"WoO 156 #1, Grove 227"	
1113	691/2			227/02	156/02	"Folksong Setting: ""Duncan Gray"", ""Duncan Gray came here to woo""; #2 of 12 Scottish songs"			1818	words: Robert Burns					"WoO 156 #2, Grove 227"	
1114	691/3			227/03	156/03	"Folksong Setting: ""Up! quit thy bower""; #3 of 12 Scottish songs"			1819	words: Joanna Baillie					"WoO 156 #3, Grove 227"	
1115	691/4			227/04	156/04	"Folksong Setting: ""Ye shepherds of this pleasant vale""; #4 of 12 Scottish songs"			1818	words: William Hamilton					"WoO 156 #4, Grove 227"	
1116	691/5			227/05	156/05	"Folksong Setting: ""Cease your funning""; #5 of 12 Scottish songs"			1817	"Words: Gay; not Scottish, derived from ""The Beggar’s Opera"""					"WoO 156 #5, Grove 227"	
1117	691/6			227/06	156/06	"Folksong Setting: ""Highland Harry"", ""My Harry was a gallant gay""; #6 of 12 Scottish songs"			1815	words: Robert Burns					"WoO 156 #6, Grove 227"	
1118	691/7			227/07	156/07	"Folksong Setting: ""Polly Stewart"", ""O lovely Polly Stewart""; #7 of 12 Scottish songs"			1818	words: Robert Burns					"WoO 156 #7, Grove 227"	
1119	691/8			227/08	156/08	"Folksong Setting: ""Womankind"", ""The hero may perish his country to save""; #8 of 12 Scottish songs"			1818	another setting - WoO 154 #10					"WoO 156 #8, Grove 227"	
1120	691/9			227/09	156/09	"Folksong Setting: ""Lochnagar"", ""Away ye gay landscapes""; #9 of 12 Scottish songs"			1818	words: Lord Byron					"WoO 156 #9, Grove 227"	
1121	691/10			227/10	156/10	"Folksong Setting: ""Glencoe"", ""O tell us, Harper""; #10 of 12 Scottish songs"			1819	words: Sir Walter Scott					"WoO 156 #10, Grove 227"	
1122	691/11			227/11	156/11	"Folksong Setting: ""Auld Lang Syne"" ""Should auld acquaintance be forgot""; #11 of 12 Scottish songs"			1818	words: Robert Burns					"WoO 156 #11, Grove 227"	
1123	691/12			227/12	156/12	"Folksong Setting: ""The Quaker’s Wife"", ""Dark was the morn and black the sea""; #12 of 12 Scottish songs"			1818	words: Mr. Hunter					"WoO 156 #12, Grove 227"	
1124	692/	—	—		158c@@@		Assorted Folk Songs (6)	1810-20				vv vn vc pf	Vocal			488
1125	692/1	156			158/01@@@	"Folksong Setting: ""Ridder Stigs Runer"" (Danish) ""Ridder nah’n dem Konigsschloss""WoO 158a; #1 of 23 continental folk songs"			1817						"WoO 158 #1, Hess 156"	
1126	692/2	187			158/07@@@	"Folksong Setting: ""Wer solche Buema afipackt"" (Tyrolean) WoO 158a; #7 of 23 continental folk songs"			1817						"WoO 158 #7, Hess 187"	
1127	692/3	189			158/08@@@	"Folksong Setting: ""Ih mag di nit nehma, du töppeter Hecht"" (Tyrolean) WoO 158a; #8 of 23 continental folk songs"			1817						"WoO 158 #8, Hess 189"	
1128	692/4	177			158/16@@@	"Folksong Setting: ""Schöne Minka, ich muß scheiden"" (Ukrainian-Cossack) WoO 158a; #16 of 23 continental folk songs"			1816	variations on this air: Op 107 #7					"WoO 158 #16, Hess 177"	
1129	692/5	186			158/17@@@	"Folksong Setting: ""Lilla Carl"", Vaggvisa (Swedish lullaby) WoO 158a; #17 of 23 continental folk songs"			1817	words: C M Bellmann					"WoO 158 #17, Hess 186"	
1130	692/6	188			158/22@@@	"Folksong Setting: ""Édes kinos emlékezet"", ""Magyar Szüretötö Enek"" (Hungarian grape harvest song) WoO 158a; #22 of 23 continental folk songs"			1817						"WoO 158 #22, Hess 188"	
1131	693/	—	105/		—		National Airs with Variations (6)	1818-19				fl/vn pf	Chamber			190
1132	693/1	—	105/1	105/1	—	"Variations for Piano & Flute or Violin in G major: on a Welsh air ""The Cottage Maid""; #1 of 6 Themes & Variations"	"Air écossais (""The Cottage Maid"")"	1818	1818	folk song setting: WoO 155 #3	G major	fl/vn pf	Chamber		"Op. 105 #1, Grove 105"	191
1133	693/2	—	105/2	105/2	—	"Variations for Piano & Flute or Violin in C minor: on a Scottish air ""Von edlem Geschlecht war Shinken""; #2 of 6 Themes & Variations"	Air écossais	1819	1818		C minor	fl/vn pf	Chamber		"Op. 105 #2, Grove 105"	192
1134	693/3	—	105/3	105/3	—	"Variations for Piano & Flute or Violin in C major: on an Austrian air ""A Schüssel und a reindel ist all mein Kuchelg’schirr""; #3 of 6 Themes & Variations"	"Air autrichien (""A Schsserl und a Reindel"")"	1818	1819		C major	fl/vn pf	Chamber		"Op. 105 #3, Grove 105"	193
1135	693/4	—	105/4	105/4	—	"Variations for Piano & Flute or Violin in E flat major: on an Irish air ""The Last Rose of Summer""; #4 of 6 Themes & Variations"	"Air écossais (""The Last Rose of Summer"")"	1818	1818	"folk song setting: ""Sad & Luckless was the Season"", WoO 153 #6"	E♭ major	fl/vn pf	Chamber		"Op. 105 #4, Grove 105"	194
1136	693/5	—	105/5	105/5	—	"Variations for Piano & Flute or Violin in E flat major: on an Irish air ""Chiling O’Guiry"": #5 of 6 Themes & Variations"	"Air écossais (""Chiling O'Guiry"")"	1818	1818	folk song setting: WoO 154 #6	E♭ major	fl/vn pf	Chamber		"Op. 105 #5, Grove 105"	195
1137	693/6	—	105/6	105/6	—	"Variations for Piano & Flute or Violin in D major: on an Irish air ""Paddy Whack""; #6 of 6 Themes & Variations"	"Air écossais (""Paddy Whack"")"	1818	1818	"folk song setting: ""English Bulls; or, The Irishman in London"", WoO 152 #12"	D major	fl/vn pf	Chamber		"Op. 105 #6, Grove 105"	196
1138	694/	—	107/		—		National Airs with Variations (10):	1818-19				fl/vn pf	Chamber			198
1139	694/1	—	107/01	107/01	—	"Variations for Piano & Flute or Violin in E flat major: theme & 4 variations on a Tyrolian air ""l bin a Tiroler Bua""; #1 of 10 Themes & Variations"	"Air tirolien (""I bin a Tiroler Bua"")"	1819	1818	folk song setting: WoO 158a #5		fl/vn pf	Chamber	see also WoO 158/5	"Op. 107 #1, Grove 107"	199
1140	694/2	—	107/02	107/02	—	"Variations for Piano & Flute or Violin in F major: theme & 4 variations on a Scottish air ""Bonnie Laddie, Highland Laddie""; #2 of 10 Themes & Variations"	"Air écossais (""Bonnie Laddie, Highland Laddie"")"	1818	1818	folk song setting: Op 108 #7		fl/vn pf	Chamber		"Op. 107 #2, Grove 107"	200
1141	694/3	—	107/03	107/03	—	Variations for Piano & Flute or Violin in G major: theme & 5 variations on a Russian air; #3 of 10 Themes & Variations	Air de la petite Russie	1819	1819			fl/vn pf	Chamber		"Op. 107 #3, Grove 107"	201
1142	694/4	—	107/04	107/04	—	"Variations for Piano & Flute or Violin in F major: theme & 4 variations on an Irish air ""St Patrick’s Day""; #4 of 10 Themes & Variations"	"Air écossais (""St. Patrick's Day"")"	1819	1818	folk song setting: WoO 154 #4		fl/vn pf	Chamber	see also WoO 154/4	"Op. 107 #4, Grove 107"	202
1143	694/5	—	107/05	107/05	—	"Variations for Piano & Flute or Violin in F major: theme & 3 variations on a Tyrolian air ""A Madel, ja a Madel"": #5 of 10 Themes & Variations"	"Air tirolien (""A Madel, ja a Madel"")"	1818	1818	folk song setting: WoO 158a #6		fl/vn pf	Chamber	see also WoO 158/6	"Op. 107 #5, Grove 107"	203
1144	694/6	—	107/06	107/06	—	"Variations for Piano & Flute or Violin in E flat major: theme & 4 variations on a Welsh air ""Merch Megan"", ""Peggy’s Daughter"": #6 of 10 Themes & Variations"	"Air écossais (""Merch Megan"")"	1818	1819	folk song setting: WoO 155 #11		fl/vn pf	Chamber	see also WoO 155/11	"Op. 107 #6, Grove 107"	204
