	Biamonti	Hess	Op.	Grove	WoO	Title 1	Title 2	Composition Dates 1	Composition Dates 2	Notes 1	Key	Scoring	Genre	Notes 2	Same As	ROW 2
593	388	328				2-part Canon in A flat major			1803	Hess 275 is a duplicate number for the same piece; Hess withdrew this number					Hess 328	
594	389					"Piece for Instrument(s): beginning of a piece for viola, cello, horn & string bass; authorship: unfinished"			1803							
595	390	329				"Sketch for Unknown: sketch for ""Tibi gratulor""; beginning of a composition for many voices; authorship: unfinished"			1803						Hess 329	
596	391					"Quartet for Unknown: beginning of a quartet ""per quattro voci"" ; authorship: unfinished"			1803	"Beethoven noted: ""zugleich gut fur den letzen zug vom Pianoforte"""						
597	392					Rondo for Piano; authorship: unfinished			1803	for the sonata Opus 53; different theme from the definitive version						
598	393					"Sketch for Unknown: for Klopstock’s song ""Im Fruhlingsschatten fand ich sie""; authorship: unfinished"			1803							
599	394					Sketch for Unknown: sketches for contradances; authorship: unfinished			1803							
600	395					"Sketch for Unknown: for a fantasia un poco adagio with the annotation ""Si continua sempre molto semplice in questa maniera""; authorship: unfinished"			1803							
601	396	330				Piece for Unknown: in the form of a march (complete sketch); authorship: unfinished									Hess 330	
602	397					Piece for Instrument(s): for instruments from strings to winds			1803	"with the annotation ""Konnte zuletz endigen mit einem Marsch"""						
603	398	072				Variations for Piano in A major: theme with one variation			1803						Hess 72	
604	399					"Sketch for Unknown: for a ""Lustige"" (Happy) symphony; authorship: unfinished"			1803							
605	400					Fugue Subject for Unknown: in a Kyrie; authorship: unfinished			1803							
606	401					Piece for Unknown			1803	"the theme is similar to Haydn’s ""The Seasons"""						
607	402					Fragment for Unknown: beginning of an Agnus Dei; authorship: unfinished			1803							
608	403					Sketch in D minor: for a symphony; authorship: unfinished			1803							
609	404					Sketch for Unknown: for the melody for a Zapfenstreich; authorship: unfinished			1803							
610	405					Sketch for Piano: for the melody; authorship: unfinished			1803							
611	406	—	055	055	—	"Symphony No. 3 in E flat major: ""Eroica"""	Symphony No.3 ('Eroica')	1803	1803	"dedicated to Prince Ferdinand Lobkowitz; Napoleon Bonaparte was originally intended as dedicatee; finale uses theme from ""Die Geschöpfe des Prometheus"" Opus 43"	E♭ major	orch	Orchestral		"Op. 55, Grove 55"	106
612	407					Sketch for Solo Voice(s) & Instrument(s): unused vocal & instrumental sketches from the Wittgenstein manuscript; authorship: unfinished			1804							
613	408	—	—		056	Bagatelle No. 5 for Piano in C major: Allegretto	Bagatelle	1803-22	1803 - 1822	"numbered ""5"" by Beethoven for a projected collection of Bagatelles in 1822"	C major	pf	Keyboard		WoO 56	351
614	409	—	—	170	057	"Andante for Piano in F major: ""Andante favori"""	Andante favori	1803-04	1803 - 1804	"originally intended as the slow movement for the ""Waldstein"" Piano Sonata Opus 53; Hess Anhang 10 is version for string quartet (Beethoven’s authorship uncertain)"	F major	pf	Keyboard	originally intended as movt. II of Op. 53; see also Hess Anh. 10	"WoO 57, Grove 170"	352
615	410	—	056	056	—	"Concerto for Piano, Violin, Cello & Orchestra in C major: ""Tripelkonzert"" (Triple Concerto)"	Triple Concerto	1804-05	1804 - 1805	dedicated to Archduke Rudolph of Austria	C major	vn vc pf orch	Orchestral		"Op. 56, Grove 56"	107
616	411	—	053	053	—	"Piano Sonata No. 21 in C major: ""Waldstein-Sonate""; ""Aurora"""	"Piano Sonata No.21 (""Waldstein"")"	1803-04	1803 - 1804	"dedicated to Count Ferdinand von Waldstein; the ""Andante favori"" WoO 57 was originally intended to be this work’s slow movement"	C major	pf	Keyboard		"Op. 53, Grove 53"	104
617	412	—	054	054	—	Piano Sonata No. 22 in F major	Piano Sonata No.22	1804	1804		F major	pf	Keyboard		"Op. 54, Grove 54"	105
618	413	111				"Duet: ""Nur hurtig fort, nur frisch gegraben"""			1805	"early version before 1805 version of ""Leonore"", Opus 72"					Hess 111	
619	414	121				"Aria in C major: Marcellina’s aria ""O wär ich schon mit dir vereint"""			1806	"prepared for 1806 version of ""Leonore"" Opus 72"					Hess 121	
620	415	122				"Aria in C minor: Marcellina’s aria ""O wär ich schon mit dir vereint"""			1807	"prepared for 1806 version of ""Leonore"", Opus 72"					Hess 122	
621	416	—	—	256	130	"Song in C minor: ""Gedenke mein""; ""Gedenke mein, ich denke dein"""	"Gedenke mein! (""Gedenke mein, ich denke dein"")"	1804-20	1804 - 1820	written for Prince Nikolas Borissovich Galitzin; words: Anonymous	E♭ major	v pf	Vocal		"WoO 130, Grove 256"	454
622	417					2 Sketches for Piano in F minor; authorship: unfinished			1804	"sketch for the ""Appassionata"" Sonata Opus 57"						
623	418			160	074/@@@	"6 Variations for Piano Four Hands in D major: on ""Ich denke dein"""			1799 - 1803	"dedicated to Therese Brunsvik & Countess Josephine Deym (née Brunsvik); Beethoven wrote the theme to the opening stanza of Goethe’s poem; the song (Biamonti 177) and the variations (Biamonti 418) are all part of the same work, but usually performed & recorded separately"					"WoO 74, Grove 160"	
624	419					Sketch for Unknown: for a march; authorship: unfinished			1804							
625	420	—	057	057	—	"Piano Sonata No. 23 in F minor: ""Appassionata"""	Piano Sonata No.23 ('Apassionata')	1804-05	1804 - 1805	dedicated to Count Anatol Brunsvik	F minor	pf	Keyboard		"Op. 57, Grove 57"	108
626	421	—	032	032	—	"Song: ""An die Hoffnung""; from Tiedge’s ""Urania""; ""Die du so gern in heilgen Nächten feierst"" (1st setting)"	"An die Hoffnung (""Die du so gern in heilgen Nächten feierst"")"	1804-05	1804 - 1805	dedicated to Countess Josephine Deym (née Brunsvik); words: Christoph August Tiedge; 2nd setiing is Opus 94		v pf	Vocal	1st setting; see also Op.94	"Op. 32, Grove 32"	66
627	422	—	138	138	—	"Overture in C major: ""Leonore I"""	Leonora Overture No.1	1807	1807		C major	orch	Orchestral	"3rd version of Opp. 72a, 72b"	"Op. 138, Grove 138"	267
628	423	—	072/a@@@	072/a@@@	—	"Overture: ""Leonore II"" ; written for 1805 version of ""Leonore""; Grove 72a"	Leonora Overture No.2	1804-05	1804 - 1805		C major	orch	Orchestral	"1st version of Opp. 72b,, 138 (included in 1st version of Op. 72)"	"Op. 72, Grove 72"	133
629	423	109	072/@@@	072/@@@	—	"Opera: ""Leonore, oder Der Triumph der ehelichen Liebe"" (Leonore, or The Triumph of Married Love); 1805 version of ""Fidelio"" with overture ""Leonore II"""	"Fidelio (Leonore, oder Der Triumph der ehelichen Liebe), opera in 3 acts"	1804-05	1804 - 1805	Libretto: Joseph Sonnleithner after Jean-Nicolas Bouilly; Hess originally had access to only the piano reduction; the complete score has since been found		vv ch orch	Stage	1st version; includes Op. 72a	"Op. 72, Hess 109, Grove 72"	130
630	424/	—	—		058@@@		Cadenzas (2)	1809			D minor	pf	Keyboard	"for movts. I and III of Piano Concerto No.20 in D minor, K.466, by Wolfgang Amadeus Mozart"		353
631	424/1			175/@@@	058/1	Cadenza for Piano in D minor: for Mozart’s piano concerto in d minor K 466 1st mvmt			1809	written for Ferdinand Ries					"WoO 58 #1, Grove 175"	
632	424/2			175/@@@	58/2	Cadenza for Piano & Orchestra in D minor: for Mozart’s piano concerto in d minor K 466 3rd mvmt			1809	written for Ferdinand Ries					"WoO 58 #2, Grove 175"	
633	425	—	036/@@@	036/@@@	—	Piano Trio in D major: after the Symphony No. 2 in D	Symphony No.2	1805	1805	dedicated to Prince Karl Lichnowsky	D major	vn vc pf	Chamber	arr. of version for orch	"Op. 36, Grove 36"	71
634	426					Fragment for Unknown: for a Quartet; authorship: unfinished			1805							
635	427/@@@	110	072/@@@	072/@@@	—	"Opera: ""Leonore, oder Der Triumph der ehelichen Liebe"" (Leonore, or The Triumph of Married Love); 1806 version of ""Fidelio"" with overture ""Leonore III"""	"Fidelio (Leonore, oder Der Triumph der ehelichen Liebe), opera in 2 acts"	1805-06	1805 - 1806	"Libretto: Joseph Sonnleithner, revised by Stephan von Breuning; Hess originally had access to only the piano reduction; the complete score has since been found"		vv ch orch	Stage	2nd version; includes Op. 72b (and WoO 2/2?)	"Op. 72, Hess 110, Grove 72"	131
636	427/@@@	—	072/b@@@	072/b@@@	—	"Overture: ""Leonore III"", Opus 72a; written for 1806 version of ""Leonore""; Grove 72b"	Leonora Overture No.3	1806	1805 - 1806		C major	orch	Orchestral	"2nd version of Opp. 72a, 138 (included in 2nd version of Op. 72)"	"Op. 72 #1, Grove 72"	134
637	428	—	—	238	132	"Song in E flat major: ""Als die Geliebte sich trennen wollte""; ""Der Hoffnung letzter Schimmer sinkt dahin"""	"Als die Geliebte sich trennen wollte(""Der Hoffnung letzter Schimmer sinkt dahin"") ('Empfindungen bei Lydiens Untreue')"	1806	1806	"also published with the title ""Empfindungen bei Lydiens Untreue""; words: Stephan von Breuning, based on French text by Hoffmann"	E♭ major	v pf	Vocal		"WoO 132, Grove 238"	456
638	429	—	060	060	—	Symphony No. 4 in B flat major	Symphony No.4	1806	1806	dedicated to Count Franz von Oppersdorff	B♭ major	orch	Orchestral		"Op. 60, Grove 60"	115
639	430	—	—	191	080	32 Variations for Piano in C minor: on an original theme	Variations (32)	1806	1806		C minor	pf	Keyboard		"WoO 80, Grove 191"	376
640	431/@@@	—	058	058	—	Concerto No. 4 for Piano & Orchestra in G major	Piano Concerto No.4	"1804-07, rev.1809"	1804 - 1807	dedicated to Archduke Rudolph of Austria; also arranged for piano & string quintet same Opus #	G major	pf orch	Orchestral	arr. for 2vn va vc db pf as Op.58a	"Op. 58, Grove 58"	109
641	431/@@@	—	058a	058a	—	Concerto No. 4 for Piano & String Quintet in G major; authorship: reconstruction	Piano Concerto No.4	1804-07	1804 - 1807	dedicated to Archduke Rudolph of Austria; also arranged for piano & string quintet same Opus #; Biamonti 509 has the usually recorded cadenzas; other cadenzas are Hess 81 (1st movement) and Hess 82 - 83 (Rondo)	G major	2vn va vc db pf	Chamber	arr. of Op.58	"Op. 58, Grove 58"	110
642	432	—	061	061	—	Concerto for Violin & Orchestra in D major	Violin Concerto	1806	1806	dedicated to Stephan von Breuning; also arranged as a piano concerto (same Opus)	D major	vn orch	Orchestral	arr for pf orch as Op.61a	"Op. 61, Grove 61"	116
643	433					"Sketch for Unknown: sketches for Matthisson’s song, ""Wunsch: noch einmal""; authorship: unfinished"			1804 - 1806							
644	434					Sketch for Unknown: for a minuet; authorship: unfinished			1805 - 1806							
645	435					Sketch for String Quartet; authorship: unfinished			1805 - 1806	"unused sketches for the first & third movements of Opus 59 #3, ""Rasumowsky"" #3"						
646	436/	—	059/	059/	—		String Quartets (3) ('Razumovsky Quartets'):	1806				2vn va vc	Chamber		"Op. 59 (all), Grove 59 (all)"	111
647	436/1	—	059/1	059/1	—	"String Quartet No. 7 in F major: ""Rasumowsky-Quartett"" (Razumovsky) #1"	String Quartet No.7	1806	1806	dedicated to Count Andreas Kirillovich Razumovsky	F major	2vn va vc	Chamber		"Op. 59 #1, Grove 59"	112
648	436/2	—	059/2	059/2	—	"String Quartet No. 8 in E minor: ""Rasumowsky-Quartett"" (Razumovsky) #2"	String Quartet No.8	1806	1806	dedicated to Count Andreas Kirillovich Razumovsky	E minor	2vn va vc	Chamber		"Op. 59 #2, Grove 59"	113
649	436/3	—	059/3	059/3	—	"String Quartet No. 9 in C major: ""Rasumowsky-Quartett"" (Razumovsky) #3"	String Quartet No.9	1806	1806	dedicated to Count Andreas Kirillovich Razumovsky	C major	2vn va vc	Chamber		"Op. 59 #3, Grove 59"	114
650	437	—	—		083	6 Ecossaises for Piano in E flat major	Ecossaises (6)	1806	1806		E♭ major	pf	Keyboard		WoO 83	379
651	438	—	062	062	—	"Overture: ""Coriolan"""	Coriolan	1807	1807	dedicated to Heinrich Collin; words by H J Collin	C minor	orch	Orchestral		"Op. 62, Grove 62"	118
652	439	—	086	086	—	Mass in C major	Mass	1807	1807	dedicated to Prince Ferdinand Kinsky; also published as 3 hymns with German text	C major	4vvch orch	Vocal		"Op. 86, Grove 86"	163
653	440	—	—		029	"March for Clarinets, Horns & Bassoons in B flat major: ""Grenadiermarsch"""	March for Wind Sextet in B-flat major('Grenadiermarsch')	1797-98	1797 - 1798	Hess 87 is piano arrangement; also see Hess 107	B♭ major	2cl 2bn 2hn	Chanber	music re-used in Hess 107; also arr. for pf	WoO 29	312
654	441	—	061a	061a	—	Concerto for Piano & Orchestra in D major	Piano Concerto	1807	1807	"dedicated to Julie von Breuning (née Vering); after the Violin Concerto (same Opus); four new ""cadenzas"" composed - the two of Biamonti 511 (given in Kinsky-Halm) & Biamonti 512 (Hess 84 & 85); all 4 can be, and usually are, played in one performance"	D major	pf orch	Orchestral	arr. of Op.61	"Op. 61, Grove 61"	117
655	442	—	—	239	133	"Song in A flat major: ""In questa tomba oscura"", Arietta (In this dark Tomb)"	"In questa tomba oscura, arietta"	1806-07	1806 - 1807	words: Giuseppe Carpani	A♭ major	v pf	Vocal		"WoO 133, Grove 239"	457
656	443	—	067	067	—	Symphony No. 5 in C minor	Symphony No.5	1804-08	1803 - 1808	dedicated to Prince Lobkowitz and Count Rasumovsky	C minor	orch	Orchestral		"Op. 67, Grove 67"	123
657	444	—	069	069	—	Sonata No. 3 for Piano & Cello in A major	Cello Sonata No.3	1807-08	1807 - 1808	"dedicated to Baron Ignaz von Gleichenstein; ""between tears & lamentation"" - LvB"	A major	vc pf	Chamber		"Op. 69, Grove 69"	125
658	445					Sketch for Unknown: sketches for an improvisation; authorship: unfinished			1807 - 1808							
659	446/1	—	—	241/1	134/1	"Song in G minor: ""Sehnsucht""; ""Nur wer die Sehnsucht kennt"" (1st setting)"	Sehnsucht	1807-08	1807 - 1808	"words: Goethe; ""NB: I did not have enough time to produce a good one, so here are several attempts"" - LvB"	G minor	v pf	Vocal	1st setting	"WoO 134 #1, Grove 241"	458
660	446/2	—	—	241/2	134/2	"Song in G minor: ""Sehnsucht""; ""Nur wer die Sehnsucht kennt"" (2nd setting)"	Sehnsucht	1807-08	1807 - 1808	"words: Goethe; ""NB: I did not have enough time to produce a good one, so here are several attempts"" - LvB"	G minor	v pf	Vocal	2nd setting	"WoO 134 #2, Grove 241"	459
661	446/3	—	—	241/3	134/3	"Song in E flat major: ""Sehnsucht""; ""Nur wer die Sehnsucht kennt"" (3rd setting)"	Sehnsucht	1807-08	1807 - 1808	"words: Goethe; ""NB: I did not have enough time to produce a good one, so here are several attempts"" - LvB"	E♭ major	v pf	Vocal	3rd setting	"WoO 134 #3, Grove 241"	460
662	446/4	—	—	241/4	134/4	"Song in G minor: ""Sehnsucht""; ""Nur wer die Sehnsucht kennt"" (4th setting)"	Sehnsucht	1807-08	1807 - 1808	"words: Goethe; ""NB: I did not have enough time to produce a good one, so here are several attempts"" - LvB"	G minor	v pf	Vocal	4th setting	"WoO 134 #4, Grove 241"	461
663	447					Passage for Piano; authorship: unfinished			1808							
664	448					Sketch for Piano: probably for piano; authorship: unfinished			1808							
665	449					Sketch for Piano & Orchestra in F major; authorship: unfinished			1808	"sketch for the ""Choral Fantasy"" Opus 80"						
666	450					Fragment for Unknown: for piano?			1808							
667	451					Sketch for Unknown: for piano?; authorship: unfinished			1808							
668	452					Fragment for Unknown: for piano?; authorship: unfinished			1808							
669	453	—	068	068	—	"Symphony No. 6 in F major: ""Pastorale"" (Pastoral)"	Symphony No.6	1807-08	1807 - 1808	dedicated to Prince Lobkowitz and Count Rasumovsky	F major	orch	Orchestral		"Op. 68, Grove 68"	124
670	454					"Overture: to the planned opera ""Macbeth""; authorship: unfinished"			1810	based on Beethoven’s sketches						
671	455/	—	070/	070/	—		Piano Trios (2):	1808				vn vc pf	Chamber		"Op. 70 (all), Grove 70 (all)"	126
672	455/1	—	070/1	070/1	—	"Piano Trio in D major: ""Geister-Trio"" (Ghost)"	Piano Trio ('Ghost')	1808	1808	dedicated to Countess Anna Marie Erdödy	D major	vn vc pf	Chamber		"Op. 70 #1, Grove 70"	127
673	455/2	—	070/2	070/2	—	Piano Trio in E flat major	Piano Trio	1808	1808	dedicated to Countess Anna Marie Erdödy	E♭ major	vn vc pf	Chamber		"Op. 70 #2, Grove 70"	128
674	456					Sketch; authorship: unfinished			1808	"4 sketches for an instrumental introduction for the ""Choral Fantasy"", Opus 80"						
675	457					Sketch; authorship: unfinished			1808	"sketch for a March, perhaps for the ""Choral Fantasy"" Opus 80"						
676	458					Sketch for Unknown in B minor; authorship: unfinished			1808	"for the ""Choral Fantasy"" Opus 80, marked ""Erste Fantasie"""						
677	459					Sketch for Piano; authorship: unfinished			1808							
678	460					Sketch for Piano; authorship: unfinished			1808							
679	461					Sketch for Piano; authorship: unfinished			1808							
680	462					Sketch for Piano; authorship: unfinished			1808							
681	463					Sketch for Piano; authorship: unfinished			1808							
682	464					Sketch for Piano; authorship: unfinished			1808							
683	465					Sketch for Piano: concluding formula; authorship: unfinished			1808							
684	466					Fragment for Piano; authorship: unfinished			1808							
685	467					Fragment for Piano; authorship: unfinished			1808							
686	468					Sketch for Piano; authorship: unfinished			1808							
687	469					Fragment for Piano; authorship: unfinished			1808							
688	470					Sketch for Piano; authorship: unfinished			1808	pianistic figure						
689	471					Fragment for Piano; authorship: unfinished			1808							
690	472					Fragment for Piano in D minor; authorship: unfinished			1808							
691	473					Sketch for Solo Voice(s) & Instrument(s); authorship: unfinished			1808							
692	474					Sketch for Unknown; authorship: unfinished			1808	bass line						
693	475					"Sketch for Unknown: ""Lasst uns Frohich sein""; authorship: unfinished"			1808	sketch for perhaps a Canon or a Song						
694	476					Sketch for Piano & Orchestra			1809	"sketch for the last movement of Piano Concerto #5, Opus 73"						
695	477					"Sketch for Unknown: ""Wehrmanns Lied"" (song of the soldier) ""Osterreich über alles""; authorship: unfinished"			1809	words: Collin						
696	478					"Sketch for Unknown: sketch for a Song ""Jubelgesang auf die Schlacht""; authorship: unfinished"			1809							
697	479					Sketch for Piano; authorship: unfinished			1809	perhaps for piano						
698	480					2 Sketches for Piano; authorship: unfinished			1809	perhaps for piano						
699	481					"Fragment for Unknown: ""Dissonirende Vorhalte""; authorship: unfinished"			1809							
700	482					Sketch for Unknown; authorship: unfinished			1809	unused sketches for Songs						
701	483					"Sketch: sketch for an Overture ""Die Änlichkeit""; authorship: unfinished"			1809							
702	484					Sketch for String Quartet			1809	unused sketch for the Finale of String Quartet #10 Opus 74						
703	485	—	074	074	—	"String Quartet No. 10 in E flat major: ""Harfenquartett"" (Harp)"	String Quartet No.10 ('Harp')	1809	1809	dedicated to Prince Ferdinand Lobkowitz	E♭ major	2vn va vc	Chamber		"Op. 74, Grove 74"	136
704	486	—	080	080	—	"Fantasia for Piano, Chorus & Orchestra in C minor: ""Chorfantasie"" (Choral Fantasy)"	Fantasia in C minor ('Choral Fantasia')	1808-09	1808 - 1809	dedicated to King Maximilian Joseph of Bavaria; words: Christoph Kuffner?	C minor	ch pf orch	Vocal		"Op. 80, Grove 80"	148
705	487					Fragment for Piano & Orchestra; authorship: unfinished			1809	"beginning of a Concerto, unused"						
706	488					"Fragment for Unknown: ""Ausweichungsformel"" (modulation formula)"			1809							
707	489					Sketch for String Quintet: in homage to Bach; authorship: unfinished			1809							
708	490					Sketch for Unknown: for a concert piece; authorship: unfinished			1809							
709	491					"Sketch for Solo Voice(s) & Instrument(s): unused sketch for ""Freudvoll und Leidvoll"" for 2 voices & piano; authorship: unfinished"			1809	"has no relation to ""Egmont"" Opus 84"						
710	492	—	077	077	—	Fantasia for Piano in G minor	Fantasia	1809	1809	dedicated to Count Anatol Brunsvik	G minor	pf	Keyboard		"Op. 77, Grove 77"	145
711	493	—	078	078	—	"Piano Sonata No. 24 in F sharp major: ""À Thérèse"""	Piano Sonata No.24 ('A Thérèse')	1809	1809	dedicated to Therese Brunsvik	F♯ major	pf	Keyboard		"Op. 78, Grove 78"	146
712	494	—	076	076	—	6 Variations for Piano in D major: on a original theme	Variations (6)	1809	1809	"dedicated to Franz Oliva; used again for ""The Ruins of Athens"" Opus 113"	D major	pf	Keyboard		"Op. 76, Grove 76"	144
713	495	—	079	079	—	Piano Sonata No. 25 in G major	Piano Sonata No.25 ('Cuckoo')	1809	1809		G major	pf	Keyboard		"Op. 79, Grove 79"	147
714	496	—	—	240	136	"Song in D major: ""Andenken"" (Memories); ""Ich denke dein"""	"Andenken (""Ich denke dein"")"	1808	1808	words: Friedrich von Matthisson	D major	v pf	Vocal		"WoO 136, Grove 240"	463
715	497	—	—	244	138	"Song in B flat major: ""Der Jüngling in der Fremde""; ""Der Früling entblühet dem Schoß der Natur"""	"Der Jüngling in der Fremde (""Der Früling entblühet dem Schoß der Natur"")"	1809	1809	words: Christian Ludwig Reissig; the music was originally written for the text of WoO 137	B♭ major	v pf	Vocal		"WoO 138, Grove 244"	465
716	498	—	—	242	137	"Song in B flat major: ""Gesang aus der Ferne"" (Song from far away); ""Als mir noch die Träne"" (2nd setting)"	"Lied aus der Ferne (""Als mir noch die Träne"")"	1809	1809	words: Christian Ludwig Reissig; other setting has no catalog #	B♭ major	v pf	Vocal		"WoO 137, Grove 242"	464
717	499	—	073	073	—	"Concerto No. 5 for Piano & Orchestra in E flat major: ""Emperor"""	Piano Concerto No.5 ('Emperor')	1808-09	1808 - 1809	dedicated to Archduke Rudolph of Austria	E♭ major	pf orch	Orchestral		"Op. 73, Grove 73"	135
718	500	—	—	243	139	"Song in D major: ""Der Liebende""; ""Welch ein wunderbares Leben"""	"Der Liebende (""Welch ein wunderbares Leben"")"	1809	1809	words: Christian Ludwig Reissig	D major	v pf	Vocal		"WoO 139, Grove 243"	466
719	501	006	—	145	018/@@@	"March for Wind Band in F major: ""Marsch für die bohmische Landwehr"""	March ('Marsch für die bohmische Landwehr') ('Yorckscher Marsch')	1809-10	1809 - 1810	"dedicated to Archduke Anton; written for a ‘carrousel’; contains Turkish elements in the orchestration; version without Trio; WoO 18 also includes Hess 7 & 99, Hess Anhang 2, and Biamonti 519 #1"	F major	ww br perc	Orchestral	"2nd version, without trio, but with 'Turkish' orchestration"	"WoO 18, Hess 6, Grove 145"	295
720	502/	—	075	075	—		Gesänge (6):	1809				v pf	Vocal		"Op. 75 (all), Grove 75 (all)"	137
721	502/1	—	075/1	075/1	—	"Song: ""Mignon"" ""Kennst du das Land"""	"Mignon (""Kennst du das Land"")"	1809	1809	dedicated to Princess Caroline Kinsky; words: Goethe		v pf	Vocal		"Op. 75 #1, Grove 75"	138
722	502/2	—	075/2	075/2	—	"Song: ""Neue Liebe, neues Leben"" (New love, new life); ""Herz, mein Herz, was soll das geben?"" (2nd setting)"	"Neue Liebe, neues Leben (""Herz, mein Herz, was soll das geben?"")"	1809	1809	dedicated to Princess Caroline Kinsky; words: Goethe; 1st setting is WoO 127		v pf	Vocal	2nd setting of WoO 27	"Op. 75 #2, Grove 75"	139
723	502/3	—	075/3	075/3	—	"Song: ""Aus Goethes Faust"" (Mephisto’s Song of the Flea); ""Es war einmal ein König"""	"Aus Goethes Faust (""Es war einmal ein König"")"	1809	1809	dedicated to Princess Caroline Kinsky; words: Goethe; originally drafted c. 1792-3		v pf	Vocal		"Op. 75 #3, Grove 75"	140
724	502/4	—	075/4	075/4	—	"Song: ""Gretels Warnung""; ""Mit Liebesblick und Spiel"""	"Gretels Warnung (""Mit Liebesblick und Spiel"")"	1809	1809	dedicated to Princess Caroline Kinsky; words: G A von Halem		v pf	Vocal		"Op. 75 #4, Grove 75"	141
725	502/5	—	075/5	075/5	—	"Song: ""An den fernen Geliebten""; ""Einst wohnten süsse Ruh’"""	"An den fernen Geliebten (""Einst wohnten süsse Ruh'"")"	1809	1809	dedicated to Princess Caroline Kinsky; words: C L Reissig		v pf	Vocal		"Op. 75 #5, Grove 75"	142
726	502/6	—	075/6	075/6	—	"Song: ""Der Zufriedene"" (The Contented Man); ""Zwar schuf das Glück hienieden"""	"Der Zufriedene (""Zwar schuf das Glück hienieden"")"	1809	1809	dedicated to Princess Caroline Kinsky; words: Christian Ludwig Reissig		v pf	Vocal		"Op. 75 #6, Grove 75"	143
727	503	—	—	255	135	"Song in C minor: ""Die laute Klage""; ""Turteltaube, du klagtest so laut"""	"Die laute Klage (""Turteltaube, du klagtest so laut"")"	1814-15	1814 - 1815	words: Johann Gottfried Herder	C minor	v pf	Vocal		"WoO 135, Grove 255"	462
728	504	099	—	145	018/@@@	"March for Piano in F major: ""Marsch für die bohmische Landwehr"""	March ('Marsch für die bohmische Landwehr') ('Yorckscher Marsch')	1809-10	1809 - 1810	"version for piano; WoO 18 also includes Hess 6 & 7, Hess Anhang 2 and Biamonti 519 #1"	F major	pf	Keyboard	arr. of 1st version	"WoO 18, Hess 99, Grove 145"	296
729	505					Sketch for Piano: unused; authorship: unfinished			1809							
730	506			175/@@@		3 Cadenzas for Piano			1809	for Piano Concerto #1 Opus 15; these are the usually recorded 1st movement cadenzas					Grove 175	
731	507			175/@@@		Cadenza for Piano			1809	for Piano Concerto #2 Opus 19; this is the usually recorded cadenza					Grove 175	
732	508			175/@@@		Cadenza for Piano			1809	for Piano Concerto #3 Opus 37; this is the usually recorded cadenza					Grove 175	
733	509			175/@@@		Cadenza for Piano			1809	"for Piano Concerto #4 Opus 58; these are the usually recorded cadenzas - #1 and #2 are for the 1st movement, #3 for the 3rd"					Grove 175	
734	510/@@@	081		175/@@@		Cadenza for Piano			1807	"for Piano Concerto #4, Opus 58 (first movement )"					"Hess 81, Grove 175"	
735	510/@@@	082		175/@@@		Cadenza for Piano			1807	"cadenza ""sensa misura"" for the Rondo of Piano Concerto #4, Opus 58"					"Hess 82, Grove 175"	
